{
  "auditDate": "2026-08-13",
  "canonicalSpec": "docs/spec/SEMANTIC_OWNERSHIP_LEDGER_v0.1.md",
  "canonicalSpecSha256": "b9a7a8e55acba113d6af38a5dcfc6333575462f6fe6a2ee1224ed263cd9441d0",
  "closureContract": "docs/spec/SELFHOST_CLOSURE_LEVELS_v0.1.json",
  "closureContractIdentitySha256": "279ba0abaa32d5aa4cf303b825216608e60e07d5ffc17059f709d8ff7f004d3e",
  "commandBindings": [
    {
      "expectedLeafCount": 1,
      "includesHidden": false,
      "routingImplementationPaths": [
        "crates/gc_cli_driver/src/lib.rs",
        "crates/gc_cli_driver/src/cmd_agent_index.rs"
      ],
      "selector": "agent-index",
      "semanticDecisionIds": [
        "SD-ROUTE-SELECTION",
        "SD-AGENT-INDEX"
      ],
      "testPaths": [
        "crates/gc_cli/tests/cli_spec_surface.rs",
        "crates/gc_wasi_cli/tests/cli_spec_surface.rs"
      ]
    },
    {
      "expectedLeafCount": 1,
      "includesHidden": false,
      "routingImplementationPaths": [
        "crates/gc_cli_driver/src/lib.rs",
        "crates/gc_cli_driver/src/cmd_agent_plan.rs"
      ],
      "selector": "agent-plan",
      "semanticDecisionIds": [
        "SD-ROUTE-SELECTION",
        "SD-AGENT-PLAN",
        "SD-EFFECT-POLICY"
      ],
      "testPaths": [
        "crates/gc_cli/tests/cli_spec_surface.rs",
        "crates/gc_wasi_cli/tests/cli_spec_surface.rs"
      ]
    },
    {
      "expectedLeafCount": 1,
      "includesHidden": false,
      "routingImplementationPaths": [
        "crates/gc_cli_driver/src/lib.rs",
        "crates/gc_cli_driver/src/cmd_security_ops.rs"
      ],
      "selector": "apply-patch",
      "semanticDecisionIds": [
        "SD-ROUTE-SELECTION",
        "SD-PATCH",
        "SD-OBLIGATION",
        "SD-EFFECT-POLICY"
      ],
      "testPaths": [
        "crates/gc_cli/tests/cli_spec_surface.rs",
        "crates/gc_wasi_cli/tests/cli_spec_surface.rs"
      ]
    },
    {
      "expectedLeafCount": 18,
      "includesHidden": true,
      "routingImplementationPaths": [
        "crates/gc_cli_driver/src/lib.rs",
        "crates/gc_cli_driver/src/cmd_bench.rs"
      ],
      "selector": "bench/*",
      "semanticDecisionIds": [
        "SD-ROUTE-SELECTION",
        "SD-BENCH",
        "SD-EVIDENCE-VERIFY",
        "SD-SIGNING"
      ],
      "testPaths": [
        "crates/gc_cli/tests/cli_spec_surface.rs",
        "crates/gc_wasi_cli/tests/cli_spec_surface.rs"
      ]
    },
    {
      "expectedLeafCount": 1,
      "includesHidden": false,
      "routingImplementationPaths": [
        "crates/gc_cli_driver/src/lib.rs",
        "crates/gc_cli_driver/src/cli_schema.rs"
      ],
      "selector": "cli-schema",
      "semanticDecisionIds": [
        "SD-ROUTE-SELECTION",
        "SD-CLI-SCHEMA"
      ],
      "testPaths": [
        "crates/gc_cli/tests/cli_spec_surface.rs",
        "crates/gc_wasi_cli/tests/cli_spec_surface.rs"
      ]
    },
    {
      "expectedLeafCount": 2,
      "includesHidden": false,
      "routingImplementationPaths": [
        "crates/gc_cli_driver/src/lib.rs",
        "crates/gc_cli_driver/src/cmd_commit.rs"
      ],
      "selector": "commit/*",
      "semanticDecisionIds": [
        "SD-ROUTE-SELECTION",
        "SD-COMMIT",
        "SD-STORE",
        "SD-EFFECT-POLICY"
      ],
      "testPaths": [
        "crates/gc_cli/tests/cli_spec_surface.rs",
        "crates/gc_wasi_cli/tests/cli_spec_surface.rs"
      ]
    },
    {
      "expectedLeafCount": 7,
      "includesHidden": false,
      "routingImplementationPaths": [
        "crates/gc_cli_driver/src/lib.rs",
        "crates/gc_cli_driver/src/cmd_debug.rs"
      ],
      "selector": "debug/*",
      "semanticDecisionIds": [
        "SD-ROUTE-SELECTION",
        "SD-DEBUG-TRACE",
        "SD-SOURCE-DECODE",
        "SD-PURE-EVAL",
        "SD-FRONTEND-CANON-IDENTITY"
      ],
      "testPaths": [
        "crates/gc_cli/tests/cli_spec_surface.rs",
        "crates/gc_wasi_cli/tests/cli_spec_surface.rs"
      ]
    },
    {
      "expectedLeafCount": 1,
      "includesHidden": false,
      "routingImplementationPaths": [
        "crates/gc_cli_driver/src/lib.rs",
        "crates/gc_cli_driver/src/cmd_core.rs"
      ],
      "selector": "eval",
      "semanticDecisionIds": [
        "SD-ROUTE-SELECTION",
        "SD-SOURCE-DECODE",
        "SD-PURE-EVAL",
        "SD-FRONTEND-CANON-IDENTITY"
      ],
      "testPaths": [
        "crates/gc_cli/tests/cli_spec_surface.rs",
        "crates/gc_wasi_cli/tests/cli_spec_surface.rs"
      ]
    },
    {
      "expectedLeafCount": 1,
      "includesHidden": false,
      "routingImplementationPaths": [
        "crates/gc_cli_driver/src/lib.rs",
        "crates/gc_cli_driver/src/cmd_core.rs"
      ],
      "selector": "explain",
      "semanticDecisionIds": [
        "SD-ROUTE-SELECTION",
        "SD-SOURCE-DECODE",
        "SD-PURE-EVAL",
        "SD-FRONTEND-CANON-IDENTITY"
      ],
      "testPaths": [
        "crates/gc_cli/tests/cli_spec_surface.rs",
        "crates/gc_wasi_cli/tests/cli_spec_surface.rs"
      ]
    },
    {
      "expectedLeafCount": 1,
      "includesHidden": false,
      "routingImplementationPaths": [
        "crates/gc_cli_driver/src/lib.rs",
        "crates/gc_cli_driver/src/cmd_source.rs"
      ],
      "selector": "fmt",
      "semanticDecisionIds": [
        "SD-ROUTE-SELECTION",
        "SD-SOURCE-DECODE",
        "SD-PRINT-FORMAT",
        "SD-FRONTEND-CANON-IDENTITY"
      ],
      "testPaths": [
        "crates/gc_cli/tests/cli_spec_surface.rs",
        "crates/gc_wasi_cli/tests/cli_spec_surface.rs"
      ]
    },
    {
      "expectedLeafCount": 5,
      "includesHidden": false,
      "routingImplementationPaths": [
        "crates/gc_cli_driver/src/lib.rs",
        "crates/gc_cli_driver/src/cmd_gc.rs"
      ],
      "selector": "gc/*",
      "semanticDecisionIds": [
        "SD-ROUTE-SELECTION",
        "SD-ARTIFACT-GC",
        "SD-STORE",
        "SD-REFS",
        "SD-EFFECT-POLICY"
      ],
      "testPaths": [
        "crates/gc_cli/tests/cli_spec_surface.rs",
        "crates/gc_wasi_cli/tests/cli_spec_surface.rs"
      ]
    },
    {
      "expectedLeafCount": 1,
      "includesHidden": false,
      "routingImplementationPaths": [
        "crates/gc_cli_driver/src/lib.rs",
        "crates/gc_cli_driver/src/cmd_security_signing.rs"
      ],
      "selector": "keygen",
      "semanticDecisionIds": [
        "SD-ROUTE-SELECTION",
        "SD-SIGNING"
      ],
      "testPaths": [
        "crates/gc_cli/tests/cli_spec_surface.rs",
        "crates/gc_wasi_cli/tests/cli_spec_surface.rs"
      ]
    },
    {
      "expectedLeafCount": 1,
      "includesHidden": false,
      "routingImplementationPaths": [
        "crates/gc_cli_driver/src/lib.rs",
        "crates/gc_cli_driver/src/mcp"
      ],
      "selector": "mcp",
      "semanticDecisionIds": [
        "SD-ROUTE-SELECTION",
        "SD-WARM-MCP",
        "SD-CLI-SCHEMA"
      ],
      "testPaths": [
        "crates/gc_cli/tests/cli_spec_surface.rs",
        "crates/gc_wasi_cli/tests/cli_spec_surface.rs"
      ]
    },
    {
      "expectedLeafCount": 1,
      "includesHidden": false,
      "routingImplementationPaths": [
        "crates/gc_cli_driver/src/lib.rs",
        "crates/gc_cli_driver/src/cmd_security_ops.rs"
      ],
      "selector": "optimize",
      "semanticDecisionIds": [
        "SD-ROUTE-SELECTION",
        "SD-SOURCE-DECODE",
        "SD-OPTIMIZATION",
        "SD-WASM-TRANSLATION",
        "SD-FRONTEND-CANON-IDENTITY"
      ],
      "testPaths": [
        "crates/gc_cli/tests/cli_spec_surface.rs",
        "crates/gc_wasi_cli/tests/cli_spec_surface.rs"
      ]
    },
    {
      "expectedLeafCount": 1,
      "includesHidden": false,
      "routingImplementationPaths": [
        "crates/gc_cli_driver/src/lib.rs",
        "crates/gc_cli_driver/src/pkg_workspace_ops.rs"
      ],
      "selector": "pack",
      "semanticDecisionIds": [
        "SD-ROUTE-SELECTION",
        "SD-PACKAGE-EXEC",
        "SD-OBLIGATION"
      ],
      "testPaths": [
        "crates/gc_cli/tests/cli_spec_surface.rs",
        "crates/gc_wasi_cli/tests/cli_spec_surface.rs"
      ]
    },
    {
      "expectedLeafCount": 1,
      "includesHidden": false,
      "routingImplementationPaths": [
        "crates/gc_cli_driver/src/lib.rs",
        "crates/gc_cli_driver/src/cmd_source.rs"
      ],
      "selector": "parse",
      "semanticDecisionIds": [
        "SD-ROUTE-SELECTION",
        "SD-SOURCE-DECODE",
        "SD-FRONTEND-CANON-IDENTITY"
      ],
      "testPaths": [
        "crates/gc_cli/tests/cli_spec_surface.rs",
        "crates/gc_wasi_cli/tests/cli_spec_surface.rs"
      ]
    },
    {
      "expectedLeafCount": 28,
      "includesHidden": false,
      "routingImplementationPaths": [
        "crates/gc_cli_driver/src/lib.rs",
        "crates/gc_cli_driver/src/cmd_pkg.rs"
      ],
      "selector": "pkg/*",
      "semanticDecisionIds": [
        "SD-ROUTE-SELECTION",
        "SD-PACKAGE-WORKSPACE",
        "SD-PACKAGE-RESOLUTION",
        "SD-PACKAGE-EXEC",
        "SD-PACKAGE-DISTRIBUTION",
        "SD-PACKAGE-ABI-DEPLOY",
        "SD-OBLIGATION",
        "SD-EFFECT-POLICY"
      ],
      "testPaths": [
        "crates/gc_cli/tests/cli_spec_surface.rs",
        "crates/gc_wasi_cli/tests/cli_spec_surface.rs"
      ]
    },
    {
      "expectedLeafCount": 3,
      "includesHidden": false,
      "routingImplementationPaths": [
        "crates/gc_cli_driver/src/lib.rs",
        "crates/gc_cli_driver/src/cmd_policy.rs"
      ],
      "selector": "policy/*",
      "semanticDecisionIds": [
        "SD-ROUTE-SELECTION",
        "SD-POLICY-ALIAS",
        "SD-EFFECT-POLICY"
      ],
      "testPaths": [
        "crates/gc_cli/tests/cli_spec_surface.rs",
        "crates/gc_wasi_cli/tests/cli_spec_surface.rs"
      ]
    },
    {
      "expectedLeafCount": 4,
      "includesHidden": false,
      "routingImplementationPaths": [
        "crates/gc_cli_driver/src/lib.rs",
        "crates/gc_cli_driver/src/cmd_refs.rs"